{
  "task_id": "IMPL-001",
  "agent_role": "implementer",
  "status": "complete",
  "files_modified": [],
  "files_created": [
    "backend/app/services/auth_service.py",
    "backend/app/models/user.py",
    "backend/app/schemas/auth.py"
  ],
  "tests_passing": true,
  "acceptance_results": [
    {
      "criterion": "AuthService class with login, logout, refresh methods",
      "met": true,
      "evidence": "Class implemented with all 3 methods plus register"
    },
    {
      "criterion": "JWT tokens with 15-min access, 7-day refresh",
      "met": true,
      "evidence": "Configurable via settings, defaults match spec"
    },
    {
      "criterion": "RBAC with admin, operator, viewer roles",
      "met": true,
      "evidence": "Role enum and permission decorator implemented"
    }
  ],
  "tokens_consumed": {
    "context": 28500,
    "output": 12000
  },
  "notes": "Implemented per ARCH-001 spec. Added rate limiting on login endpoint as defensive measure. Refresh token rotation implemented with one-time use tokens stored in sessions table.",
  "started_at": "2026-03-23T20:15:00Z",
  "completed_at": "2026-03-23T20:32:00Z"
}
